{
  "$schema": "../../../../../docs/packs/schema/lang-unit.schema.json",
  "id": "u37",
  "words": {
    "amawulire": { "text": "nouvelles", "alts": ["les nouvelles", "actualités", "les infos", "infos"] },
    "owulidde": { "text": "Tu as entendu", "alts": ["as-tu entendu", "vous avez entendu"] },
    "leediyo": { "text": "radio", "alts": ["la radio"] },
    "nti": { "text": "que" },
    "agamba": { "text": "il dit", "alts": ["elle dit", "dit"] },
    "bagamba": { "text": "ils disent", "alts": ["on dit", "les gens disent"] },
    "olukiiko": { "text": "réunion", "alts": ["conseil", "assemblée", "la réunion"] },
    "ssentebe": { "text": "président", "alts": ["présidente", "le président", "la présidente"] },
    "ndowooza": { "text": "je pense", "alts": ["je crois", "je suppose"] },
    "endowooza": { "text": "avis", "alts": ["opinion", "idée", "point de vue", "l’avis"] },
    "nzikiriza": { "text": "je suis d’accord", "alts": ["j’accepte", "je crois"] },
    "sikkiriza": { "text": "je ne suis pas d’accord", "alts": ["je suis pas d’accord", "je n’accepte pas"] },
    "jamii": { "text": "communauté", "alts": ["société", "la communauté"] },
    "kiongozi": { "text": "dirigeant", "alts": ["dirigeante", "responsable", "le dirigeant", "chef"] },
    "serikali": { "text": "gouvernement", "alts": ["le gouvernement", "l’État"] },
    "uchaguzi": { "text": "élection", "alts": ["élections", "les élections", "l’élection"] },
    "kura": { "text": "vote", "alts": ["voix", "bulletin"] },
    "harambee": { "text": "harambee", "alts": ["tous ensemble", "collecte", "tirons ensemble"] },
    "tusaidiane": { "text": "Entraidons-nous", "alts": ["aidons-nous les uns les autres", "on s’entraide"] },
    "tunapendana": { "text": "nous nous aimons", "alts": ["on s’aime"] },
    "gazeti": { "text": "journal", "alts": ["le journal"] },
    "taarifa-ya-habari": { "text": "le journal télévisé", "alts": ["les informations", "le bulletin d’information", "les infos"] },
    "tukio": { "text": "événement", "alts": ["incident", "l’événement"] },
    "tatizo": { "text": "problème", "alts": ["le problème", "souci"] },
    "suluhisho": { "text": "solution", "alts": ["la solution", "réponse"] },
    "kwa-maoni-yangu": { "text": "à mon avis", "alts": ["selon moi", "d’après moi"] },
    "muhimu": { "text": "important", "alts": ["importante", "nécessaire", "essentiel"] }
  },
  "sentences": {
    "s37-owulidde-amawulire": { "text": "Tu as entendu la nouvelle ?", "alts": ["Tu as entendu les nouvelles ?", "As-tu entendu la nouvelle ?"] },
    "s37-ku-leediyo": { "text": "Je l’ai entendu à la radio.", "alts": ["Je l’ai entendue à la radio."] },
    "s37-agamba-nti": {
      "text": "Il dit que la pluie arrive.",
      "alts": ["Elle dit que la pluie arrive.", "Il dit qu’il va pleuvoir.", "Elle dit qu’il va pleuvoir."]
    },
    "s37-bagamba-nti": {
      "text": "On dit que la nouvelle route est finie.",
      "alts": ["Ils disent que la nouvelle route est terminée.", "Les gens disent que la nouvelle route est finie."]
    },
    "s37-olukiiko": { "text": "La réunion a lieu samedi.", "alts": ["La réunion est samedi."] },
    "s37-ssentebe": {
      "text": "Le président parle à la réunion.",
      "alts": ["La présidente parle à la réunion.", "Le président prend la parole à la réunion."]
    },
    "s37-ndowooza-nti": { "text": "Je pense que c’est bien.", "alts": ["Je crois que c’est bien.", "Je pense que c’est bon."] },
    "s37-endowooza-yo": { "text": "Quel est ton avis ?", "alts": ["Qu’est-ce que tu en penses ?", "Quel est votre avis ?"] },
    "s37-nzikiriza": { "text": "Je suis d’accord avec toi.", "alts": ["Je suis d’accord avec vous."] },
    "s37-sikkiriza": {
      "text": "Je ne suis pas d’accord. Je pense que ce n’est pas bien.",
      "alts": ["Je ne suis pas d’accord. Je crois que ce n’est pas bien."]
    },
    "s-jamii": { "text": "Notre communauté est grande." },
    "s-mkutano": { "text": "Il y a une réunion demain soir." },
    "s-kiongozi": { "text": "Notre dirigeante est une femme compétente.", "alts": ["Notre responsable est une femme capable."] },
    "s-serikali": { "text": "Le gouvernement va construire une nouvelle école.", "alts": ["Le gouvernement construira une nouvelle école."] },
    "s-uchaguzi": { "text": "L’élection aura lieu l’année prochaine.", "alts": ["Les élections auront lieu l’année prochaine."] },
    "s-kura": { "text": "Je vais voter.", "alts": ["Je voterai."] },
    "s-harambee": { "text": "Nous organisons un harambee pour l’hôpital.", "alts": ["Nous faisons une collecte pour l’hôpital."] },
    "s-tusaidiane": { "text": "Entraidons-nous !", "alts": ["Aidons-nous les uns les autres !", "On s’entraide !"] },
    "s-tunapendana": { "text": "Dans notre famille, nous nous aimons.", "alts": ["Dans notre famille, on s’aime."] },
    "s-gazeti": {
      "text": "Papa lit le journal tous les matins.",
      "alts": ["Mon père lit le journal tous les matins.", "Papa lit le journal chaque matin."]
    },
    "s-redio": { "text": "J’ai entendu la nouvelle à la radio.", "alts": ["J’ai entendu les infos à la radio."] },
    "s-taarifa": { "text": "Le journal est à huit heures du soir.", "alts": ["Les informations sont à 20 h.", "Le journal est à 20 heures."] },
    "s-tukio": { "text": "L’événement s’est passé en ville hier.", "alts": ["L’incident a eu lieu en ville hier."] },
    "s-tatizo": { "text": "Le gros problème, c’est l’eau.", "alts": ["Le plus gros problème, c’est l’eau."] },
    "s-suluhisho": { "text": "Nous voulons une solution.", "alts": ["On veut une solution."] },
    "s-maoni": { "text": "Quel est ton avis ?", "alts": ["Qu’est-ce que tu en penses ?", "Quel est votre avis ?"] },
    "s-nadhani": { "text": "Je pense qu’il va pleuvoir aujourd’hui.", "alts": ["Je crois qu’il va pleuvoir aujourd’hui."] },
    "s-kwa-maoni-yangu": { "text": "À mon avis, l’école est très importante.", "alts": ["Selon moi, l’école est très importante."] },
    "s-nakubali": { "text": "Je suis d’accord, c’est vrai." },
    "s-sikubaliani": {
      "text": "Désolé, je ne suis pas d’accord avec toi.",
      "alts": ["Désolée, je ne suis pas d’accord avec toi.", "Pardon, je ne suis pas d’accord avec vous."]
    }
  },
  "phrases": [
    "Tu as entendu la nouvelle ?",
    "Il dit que la pluie arrive.",
    "On dit que la nouvelle route est finie.",
    "Je pense que c’est bien.",
    "Quel est ton avis ?",
    "Je suis d’accord avec toi."
  ],
  "dialogues": {
    "u37s2l3": [
      {
        "line": "Tu as entendu la nouvelle ?",
        "options": ["Oui ! On dit que la nouvelle route est finie.", "Je voudrais du thé.", "Il était une fois, un jour…"]
      }
    ],
    "u37s3l3": [
      {
        "line": "Je pense qu’on devrait planter des arbres au village. Quel est ton avis ?",
        "options": ["Je suis d’accord avec toi !", "Tu l’as entendu à la radio ?", "Je n’ai plus faim."]
      }
    ]
  },
  "stories": {
    "sw-harambee": {
      "title": "Le harambee",
      "summary": "Amani et Neema vont à un harambee pour les frais de scolarité d’un voisin.",
      "lines": [
        "Amani, pourquoi y a-t-il autant de monde ici ?",
        "C’est un harambee. L’enfant du voisin a obtenu une place à l’université.",
        "Génial ! Je vais donner deux mille shillings.",
        "Merci. Un seul doigt ne peut pas écraser un pou.",
        "C’est vrai. Entraidons-nous !"
      ],
      "questions": [
        {
          "question": "À quoi sert le harambee ?",
          "options": ["La place à l’université de l’enfant du voisin", "Un mariage", "Une nouvelle route"]
        },
        {
          "question": "Que veut dire le proverbe d’Amani ?",
          "options": ["Nous avons besoin les uns des autres", "Les doigts sont petits", "Lave-toi les mains"]
        },
        { "question": "Comment Neema dit-elle « entraidons-nous » ?", "options": ["Entraidons-nous", "Nous nous aimons", "Allons-y"] }
      ]
    },
    "sw-morning-paper": {
      "title": "Le journal du matin",
      "summary": "Baraka et Juma lisent le journal autour d’un chai et ne sont pas tout à fait d’accord.",
      "lines": [
        "Juma, tu as lu le journal d’aujourd’hui ?",
        "Pas encore. Quelles sont les nouvelles ?",
        "Le gouvernement va construire une nouvelle route dans notre village.",
        "À mon avis, l’eau est plus importante qu’une route.",
        "Désolé, je ne suis pas d’accord. Une route amènera du commerce.",
        "Alors écrivons nos avis au journal !"
      ],
      "questions": [
        { "question": "Que va construire le gouvernement ?", "options": ["Une nouvelle route", "Une nouvelle école", "Un hôpital"] },
        { "question": "Selon Juma, qu’est-ce qui est plus important ?", "options": ["L’eau", "La route", "Le commerce"] },
        {
          "question": "Comment Baraka dit-il « je ne suis pas d’accord » ?",
          "options": ["Je ne suis pas d’accord", "Je suis d’accord", "Je pense"]
        }
      ]
    }
  }
}
