{
  "$schema": "../../../../../docs/packs/schema/lang-unit.schema.json",
  "id": "u20",
  "words": {
    "nja": { "text": "nja" },
    "kugenda": { "text": "kugenda" },
    "tujja": { "text": "tudha" },
    "ajja": { "text": "adha" },
    "awamu": { "text": "awamu" },
    "wiikendi": { "text": "wiikendi" },
    "wiiki-ejja": { "text": "wiiki edha" },
    "omwaka-ogujja": { "text": "omwaka ogudha" },
    "okukyalira": { "text": "okukyalira" },
    "ndigenda": { "text": "Ndigenda" },
    "ndyogera": { "text": "Ndyogera" },
    "olunaku-lumu": { "text": "olunaku lumu" },
    "nsuubira": { "text": "Nsuubira" },
    "oteekateeka-ki": { "text": "Oteekateeka ki?" },
    "utaenda": { "text": "oligenda" },
    "atakuja": { "text": "alidha" },
    "tutakutana": { "text": "Tulisisinkana" },
    "nitarudi": { "text": "Ndikomawo" },
    "mwezi-ujao": { "text": "omwezi ogudha" },
    "ndoto": { "text": "ekirooto" }
  },
  "sentences": {
    "s20-nja-kugenda-masaka": { "text": "Enkya nja kugenda e {@hometown}." },
    "s20-nja-kulya": { "text": "Nja kulya matooke." },
    "s20-tujja-kusoma": { "text": "Tudha kusoma awamu." },
    "s20-ajja-kujja": { "text": "{@nakato} adha kudha enkya." },
    "s20-wiikendi": { "text": "Ku wiikendi nja kukyalira dhaadha." },
    "s20-wiiki-ejja": { "text": "Wiiki edha tudha kugenda e {@getaway}." },
    "s20-omwaka-ogujja": { "text": "Omwaka ogudha nja kusoma saayansi." },
    "s20-olunaku-lumu-ndigenda": { "text": "Olunaku lumu ndigenda e Buganda." },
    "s20-ndyogera-oluganda": { "text": "Olunaku lumu ndyogera {to} bulungi." },
    "s20-nsuubira": { "text": "Nsuubira okubona Kabaka." },
    "s20-oteekateeka-ki": { "text": "Oteekateeka ki ku wiikendi?" },
    "s-nisaidie-tafadhali": { "text": "Nyamba, mwatu." },
    "s-kwanza-halafu": { "text": "Sooka oyoze ebibya, oluvanyuma oyere." },
    "s-pamoja": { "text": "Tukolere wamu." },
    "s-nitaenda-kazini": { "text": "Enkya nja kugenda ku mulimu." },
    "s-bibi-atakuja": { "text": "Dhaadha alidha ku Lwomukaaga." },
    "s-tutakutana": { "text": "Tulisisinkana saawa munaana." },
    "s-nitarudi": { "text": "Ndikomawo wiiki edha." },
    "s-mwezi-ujao": { "text": "Omwezi ogudha nditambula." },
    "s-ningependa-kahawa": { "text": "Nandyagade kaawa, mwatu." },
    "s-ningependa-kusafiri": { "text": "Nandyagade okutambula." },
    "s-ndoto-yangu": { "text": "Ekirooto kyange kwe kuba omusawo." },
    "s-siku-moja": { "text": "Olunaku lumu ndiba musomesa." }
  },
  "phrases": [
    "Enkya nja kugenda e {@hometown}.",
    "Tudha kusoma awamu.",
    "Oteekateeka ki ku wiikendi?",
    "Ku wiikendi nja kukyalira dhaadha.",
    "Olunaku lumu ndyogera {to} bulungi.",
    "Nsuubira okubona Kabaka."
  ],
  "dialogues": {
    "u20s2l3": [{ "line": "Oteekateeka ki ku wiikendi?", "options": ["Nja kukyalira dhaadha.", "Idho nagenda e {@getaway}.", "Simanyi omusota."] }]
  },
  "stories": {
    "weekend-plans": {
      "title": "Enteekateeka za wiikendi",
      "summary": "{@ssali} ne {@nakato} boogera ku wiikendi ewede n’eyo edha.",
      "lines": [
        "{@nakato}! Wiikendi ewede wakola ki?",
        "Nagenda e {@hometown} okukyalira maama.",
        "Kirungi! Ate ku wiikendi eno?",
        "Simanyi. Oteekateeka ki iwe?",
        "Nja kugenda ku nyanja e {@nearby}. Odha?",
        "Ee! Naye sirina sente nyingi.",
        "Totya. Tudha kugenda mu motoka yange.",
        "Weebale inho! Tulibonagana ku Lwamukaaga."
      ],
      "questions": [
        { "question": "{@nakato} yagenda wa wiikendi ewede?", "options": ["{@getaway}", "{@hometown}", "{@nearby}"] },
        { "question": "{@ssali} ateekateeka ki?", "options": ["Okugenda ku nyanja", "Okukyalira maama we", "Okusomera awaka"] },
        { "question": "Mu Lungereza ogamba otya “Tudha kugenda”?", "options": ["Tudha kugenda", "Twagenda", "Togenda"] }
      ]
    }
  }
}
