{
  "$schema": "../../../../../docs/packs/schema/lang-unit.schema.json",
  "id": "u25",
  "words": {
    "ekika": { "text": "suru" },
    "ebika": { "text": "suruyi" },
    "omuziro": { "text": "ozu" },
    "emiziro": { "text": "ozuyi" },
    "kya": { "text": "ni" },
    "gwa": { "text": "ni" },
    "ffumbe": { "text": "Ffumbe" },
    "lugave": { "text": "lugave" },
    "mmamba": { "text": "mmamba" },
    "ngeye": { "text": "ngeye" },
    "ndi-wa": { "text": "Ma ni … suru" },
    "oli-wa-kika-ki": { "text": "Mi ni suru ngo?" },
    "tetulya": { "text": "ama nya ku" },
    "owooluganda": { "text": "aku ba alu" },
    "jjajja-omutaka": { "text": "suru opi" },
    "pwani": { "text": "ii amboa gere" },
    "bahari": { "text": "ii amboa" },
    "kisiwa": { "text": "kisiwa" },
    "jahazi": { "text": "jahazi" },
    "kaskazi": { "text": "oli kaskazi" },
    "wafanyabiashara": { "text": "ozi bayi" },
    "lugha": { "text": "ti" },
    "kutoka-kiarabu": { "text": "Arabuti ni" },
    "wenye": { "text": "be" },
    "maarufu": { "text": "ru amboa" },
    "mji-wa-kale": { "text": "taun ndra'bo" }
  },
  "sentences": {
    "s25-ekika-kyange": { "text": "Ma suru ni Ffumbe." },
    "s25-ebika-bingi": { "text": "Buganda alia suruyi ambo ovu." },
    "s25-omuziro-gwange": { "text": "Ma ozu ni lugave." },
    "s25-ekika-kya-mmamba": { "text": "Mmamba suru amboa." },
    "s25-ndi-wa-lugave": { "text": "Ma ni Lugave suru." },
    "s25-oli-wa-kika-ki": { "text": "Mi ni suru ngo?" },
    "s25-tetulya-mmamba": { "text": "Ama nya mmamba ku." },
    "s25-omuziro-gwa-ngeye": { "text": "Ngeye ozu ni oyi ngeye." },
    "s25-tuli-booluganda": { "text": "Ama ni aku ba alu." },
    "s25-omutaka": { "text": "Suru opi emu." },
    "s-pwani-nzuri": { "text": "Ii amboa gere aradu ndra." },
    "s-bahari-kubwa": { "text": "Ii amboa amboa ndra!" },
    "s-kisiwa-cha-zanzibar": { "text": "Zanzibar ni kisiwa." },
    "s-jahazi-baharini": { "text": "Jahazi ovu ii amboa dria." },
    "s-kaskazi": { "text": "Oli kaskazi ji jahaziyi emu ra." },
    "s-wafanyabiashara-walifika": { "text": "Ozi bayi emu Arabu ka India ni ra." },
    "s-lugha-ya-pwani": { "text": "Swahiliti ni ii amboa gere ti." },
    "s-maneno-kiarabu": { "text": "E'yo \"kitabu\" ni Arabuti ni." },
    "s-mji-wenye-historia": { "text": "Lamu ni taun e'yo ndra'bo ni be." },
    "s-maarufu": { "text": "Kilwa taun ndra'bo ru amboa." }
  },
  "phrases": ["Mi ni suru ngo?", "Ma ni Lugave suru.", "Ma suru ni Ffumbe.", "Ma ozu ni lugave.", "Ama nya mmamba ku.", "Ama ni aku ba alu."],
  "dialogues": { "u25s3l3": [{ "line": "Mi ni suru ngo, ma mva?", "options": ["Ma ni Lugave suru, Dede.", "Ma tia ndra.", "Ji ayi kpe."] }] },
  "stories": {}
}
