{
  "$schema": "../../../../../docs/packs/schema/lang-unit.schema.json",
  "id": "u27",
  "words": {
    "olusuku": { "text": "shamba la migomba", "alts": ["shamba la ndizi", "shamba", "migomba"] },
    "enkumbi": { "text": "jembe", "alts": ["jembe la mkono"] },
    "ndima": { "text": "ninalima", "alts": ["nalima", "ninakulima", "ninachimba"] },
    "ensigo": { "text": "mbegu", "alts": ["mbegu za kupanda"] },
    "okusiga": { "text": "kupanda", "alts": ["kupanda mbegu", "upanzi"] },
    "kasooli": { "text": "mahindi", "alts": ["mhindi", "gunzi"] },
    "ebinyeebwa": { "text": "karanga", "alts": ["njugu", "njugu karanga"] },
    "emmwanyi": { "text": "kahawa", "alts": ["mibuni", "buni", "miche ya kahawa"] },
    "amakungula": { "text": "mavuno", "alts": ["msimu wa mavuno", "wakati wa mavuno"] },
    "okukungula": { "text": "kuvuna", "alts": ["kuvuna mazao"] },
    "ndimira": { "text": "ninalimia", "alts": ["nalimia", "ninamlimia"] },
    "nfumbira": { "text": "ninapikia", "alts": ["napikia", "ninawapikia"] },
    "ntundira": { "text": "ninauzia", "alts": ["nauzia", "ninauza katika"] },
    "mpandiikira": { "text": "ninaandikia", "alts": ["naandikia", "ninamwandikia"] }
  },
  "sentences": {
    "s27-olusuku-lwange": { "text": "Shamba langu la migomba ni kubwa.", "alts": ["Shamba langu ni kubwa.", "Shamba langu la ndizi ni kubwa."] },
    "s27-ndima-n-enkumbi": { "text": "Ninalima kwa jembe asubuhi.", "alts": ["Nalima kwa jembe asubuhi.", "Asubuhi ninalima kwa jembe."] },
    "s27-okusiga-ensigo": { "text": "Tunapanda mbegu wakati wa mvua.", "alts": ["Tunapanda mbegu msimu wa mvua.", "Tunapanda mbegu masika."] },
    "s27-kasooli": { "text": "Mahindi yamekua vizuri.", "alts": ["Mahindi yamestawi vizuri."] },
    "s27-ebinyeebwa": { "text": "Ninauza karanga na mahindi.", "alts": ["Nauza karanga na mahindi.", "Ninauza njugu na mahindi."] },
    "s27-emmwanyi": { "text": "Kahawa ya Buganda ni nzuri sana.", "alts": ["Kahawa ya Buganda ni bora sana."] },
    "s27-amakungula": { "text": "Mavuno yamefika!", "alts": ["Wakati wa mavuno umefika!", "Mavuno yamewadia!"] },
    "s27-okukungula": { "text": "Kesho tutavuna karanga.", "alts": ["Tutavuna karanga kesho.", "Kesho tutavuna njugu."] },
    "s27-ndimira-jjajja": {
      "text": "Ninamlimia bibi shamba.",
      "alts": ["Ninamlimia babu shamba.", "Ninamlimia bibi shamba la migomba.", "Ninalimia bibi shamba."]
    },
    "s27-nfumbira-abaana": { "text": "Ninawapikia watoto chakula.", "alts": ["Nawapikia watoto chakula.", "Ninawapikia watoto."] },
    "s27-ntundira-mu-katale": { "text": "Ninauzia kahawa sokoni.", "alts": ["Nauza kahawa sokoni.", "Ninauza kahawa sokoni."] },
    "s27-mpandiikira-maama": { "text": "Ninamwandikia mama ujumbe.", "alts": ["Namwandikia mama ujumbe.", "Ninamwandikia mama yangu ujumbe."] }
  },
  "phrases": [
    "Ninalima kwa jembe asubuhi.",
    "Tunapanda mbegu wakati wa mvua.",
    "Mavuno yamefika!",
    "Ninamlimia bibi shamba.",
    "Ninawapikia watoto chakula.",
    "Ninamwandikia mama ujumbe."
  ],
  "dialogues": { "u27s3l3": [{ "line": "Pole na kazi! Unafanya nini?" }] }
}
