{
  "$schema": "../../../../../docs/packs/schema/lang-unit.schema.json",
  "id": "u14",
  "words": {
    "omulimi": { "text": "omulimi" },
    "abalimi": { "text": "abalimi" },
    "omusuubuzi": { "text": "omusuubuzi" },
    "omuvuzi": { "text": "omuvuzi" },
    "omufumbi": { "text": "omufumbi" },
    "omuzimbi": { "text": "omuzimbi" },
    "omupoliisi": { "text": "omupoliisi" },
    "omukozi": { "text": "omukozi" },
    "abakozi": { "text": "abakozi" },
    "okola-mulimu-ki": { "text": "Okola mulimu ki?" },
    "ofiisi": { "text": "ofiisi" },
    "ennimiro": { "text": "enimiro" },
    "okulima": { "text": "okulima" },
    "okuvuga": { "text": "okuvuga" },
    "omusaala": { "text": "omusaala" },
    "nfuna": { "text": "Nfuna" },
    "nkolera": { "text": "Nkolera" },
    "kampuni": { "text": "kampuni" },
    "nkola-nnyo": { "text": "Nkola inho" },
    "fundi": { "text": "omukugu" },
    "muuguzi": { "text": "naasi" },
    "anafanya": { "text": "akolera" },
    "tunafanya": { "text": "tukolera" },
    "wanafanya": { "text": "bakolera" },
    "bosi": { "text": "bosi" }
  },
  "sentences": {
    "s14-ndi-mulimi": { "text": "Ndi mulimi." },
    "s14-abalimi-balima": { "text": "Abalimi balima mu nimiro." },
    "s14-maama-musuubuzi": { "text": "Maama musuubuzi." },
    "s14-ssali-muvuzi": { "text": "{@ssali} muvuzi." },
    "s14-omufumbi-afumba": { "text": "Omufumbi afumba emere." },
    "s14-omuzimbi-azimba": { "text": "Omuzimbi azimba enyumba." },
    "s14-omupoliisi-ali-wano": { "text": "Omupoliisi ali wano." },
    "s14-okola-mulimu-ki": { "text": "Okola mulimu ki?" },
    "s14-nkola-mu-ofiisi": { "text": "Nkola mu ofiisi." },
    "s14-njagala-okuvuga": { "text": "Njagala okuvuga." },
    "s14-nfuna-omusaala": { "text": "Nfuna omusaala buli mwezi." },
    "s14-abakozi-bangi": { "text": "Kampuni erina abakozi bangi." },
    "s14-nkolera-kampuni": { "text": "Nkolera kampuni enene." },
    "s14-nkola-nnyo": { "text": "Nkola inho buli lunaku." },
    "s-baba-dereva": { "text": "Taata wange muvuzi wa motoka." },
    "s-mpishi-anapika": { "text": "Omufumbi afumba omuceere." },
    "s-dada-muuguzi": { "text": "Mwanyinaze naasi." },
    "s-fundi-yuko-wapi": { "text": "Omukugu ali luda wa?" },
    "s-askari-nje": { "text": "Omupoliisi ali bweru." },
    "s-mfanyabiashara-duka": { "text": "Omusuubuzi alina eduuka." },
    "s-juma-anafanya": { "text": "{@ssali} akolera Nairobi." },
    "s-tunafanya-pamoja": { "text": "Tukolera wamu." },
    "s-wanafanya-ofisini": { "text": "Bakolera mu ofiisi." },
    "s-kampuni-kubwa": { "text": "Kampuni nene." },
    "s-bosi-mpole": { "text": "Bosi wange muteefu." }
  },
  "phrases": ["Okola mulimu ki?", "Ndi mulimi.", "Maama musuubuzi.", "Nkola mu ofiisi.", "Nkolera kampuni enene.", "Nfuna omusaala buli mwezi."],
  "dialogues": { "u14s2l3": [{ "line": "Okola mulimu ki?", "options": ["Ndi musomesa.", "Ente zirya omudo.", "Mpulira empewo."] }] },
  "stories": {}
}
