{
  "$schema": "../../../../../docs/packs/schema/lang-unit.schema.json",
  "id": "u5",
  "words": {
    "leero": { "text": "tin" },
    "enkya": { "text": "diki" },
    "jjo": { "text": "lawoo" },
    "olunaku": { "text": "nino" },
    "wiiki": { "text": "cabit" },
    "omwezi": { "text": "dwe" },
    "omwaka": { "text": "mwaka" },
    "makya": { "text": "odiko" },
    "olweggulo": { "text": "dyeceng" },
    "ekiro": { "text": "dyewor" },
    "bbalaza": { "text": "Ceng Baraja" },
    "lwakubiri": { "text": "Ceng Aryo" },
    "lwakusatu": { "text": "Ceng Adek" },
    "lwakuna": { "text": "Ceng Angwen" },
    "lwakutaano": { "text": "Ceng Abic" },
    "lwamukaaga": { "text": "Ceng Abicel" },
    "ssabbiiti": { "text": "Ceng Cabit" },
    "essaawa": { "text": "cawa" },
    "ssaawa-mmeka": { "text": "Cawa adi?" },
    "ssaawa-emu": { "text": "cawa acel" },
    "ssaawa-nnya": { "text": "cawa angwen" },
    "ssaawa-mukaaga": { "text": "cawa abicel" },
    "na-nusu": { "text": "ki nucu" },
    "jioni": { "text": "otyeno" }
  },
  "sentences": {
    "s-nsoma-leero": { "text": "Atye ka kwano tin.", "alts": ["Akwano tin."] },
    "s-tunaalabagana-enkya": { "text": "Wabinen diki." },
    "s-buli-lunaku": { "text": "Apwonye Leb Ganda nino ducu." },
    "s-nnywa-caayi-ku-makya": { "text": "Amato cai odiko." },
    "s-ndya-olweggulo": { "text": "Acamo matoke dyeceng." },
    "s-nsoma-ekiro": { "text": "Akwano buk dyewor." },
    "s-ku-bbalaza": { "text": "Akwano i Ceng Baraja." },
    "s-ku-lwakutaano": { "text": "Wabinen i Ceng Abic." },
    "s-ssaawa-mmeka": { "text": "Cawa adi?" },
    "s-ssaawa-nnya": { "text": "Cawa angwen." },
    "s-ssaawa-emu-ku-makya": { "text": "Cawa acel odiko." },
    "s-saa-ngapi-sasa": { "text": "Kombedi cawa adi?" },
    "s-saa-tatu-na-nusu": { "text": "Cawa adek ki nucu." },
    "s-saa-sita-mchana": { "text": "Cawa abicel dyeceng." },
    "s-saa-mbili-usiku": { "text": "Cawa aryo dyewor." },
    "s-leo-na-kesho": { "text": "Tin ki diki." },
    "s-jana-jioni": { "text": "Lawoo otyeno." },
    "s-siku-saba": { "text": "Cabit tye ki nino abiro." },
    "s-leo-ni-jumatatu": { "text": "Tin obedo Ceng Baraja." },
    "s-kesho-ni-jumanne": { "text": "Diki obedo Ceng Aryo." },
    "s-jumamosi-na-jumapili": { "text": "Ceng Abicel ki Ceng Cabit." },
    "s-kila-mwezi": { "text": "Dwe ducu acito i {@getaway}." },
    "s-kila-mwaka": { "text": "Kot madongo bino mwaka ducu." }
  },
  "phrases": ["Tin", "Diki", "Wabinen diki.", "Akwano i Ceng Baraja.", "Cawa adi?", "Cawa angwen."],
  "dialogues": { "u5s3l2": [{ "line": "Cawa adi?", "options": ["Cawa angwen.", "Ciling alip aryo.", "I Ceng Baraja."] }] },
  "stories": {}
}
