{
  "$schema": "../../../../../docs/packs/schema/lang-unit.schema.json",
  "id": "u21",
  "words": {
    "nsanyuse": { "text": "Cwinya yom" },
    "nnakuwadde": { "text": "Cwinya cwer" },
    "oli-bulungi": { "text": "Itye maber?" },
    "nneewuunya": { "text": "Aur" },
    "nkooye": { "text": "Aol" },
    "ntidde": { "text": "Lworo omaka" },
    "nneeraliikirira": { "text": "Aparo" },
    "nnyiize": { "text": "Cwinya owang" },
    "ali-atya": { "text": "tye nining?" },
    "bambi": { "text": "Cwinya cwer piri" },
    "nsonyiwa": { "text": "Timwa kica" },
    "nkwagala": { "text": "Amari" },
    "nkusubwa": { "text": "Apari" },
    "mukwano-gwange": { "text": "lawota" },
    "tokaaba": { "text": "Pe ikok" },
    "samahani": { "text": "Kica" },
    "furaha": { "text": "yomcwiny" },
    "nina-furaha": { "text": "Atye ki yomcwiny" },
    "huzuni": { "text": "cwercwiny" },
    "hasira": { "text": "akemo" },
    "naogopa": { "text": "Alworo" },
    "wasiwasi": { "text": "par" },
    "kuhusu": { "text": "i kom" },
    "usijali": { "text": "Pe iparo" },
    "bahati-njema": { "text": "Gum maber" }
  },
  "sentences": {
    "s21-nsanyuse-nnyo": { "text": "Tin cwinya yom matek!" },
    "s21-lwaki-onakuwadde": { "text": "Pingo cwinyi cwer?" },
    "s21-oli-bulungi": { "text": "Itye maber, lawota?" },
    "s21-nneewuunya": { "text": "Aur! Ibino tin?" },
    "s21-nkooye-nnyo": { "text": "Aol matek. Abinino." },
    "s21-ntidde": { "text": "Lworo omaka, polo tye ka mor." },
    "s21-nneeraliikirira": { "text": "Aparo i kom tem." },
    "s21-nnyiize": { "text": "Cwinya owang pien takci pe obino." },
    "s21-maama-ali-atya": { "text": "Mego meri tye nining?" },
    "s21-bambi": { "text": "Cwinya cwer piri! Cang oyot." },
    "s21-nsonyiwa": { "text": "Timwa kica, abino lacen." },
    "s21-nkwagala-maama": { "text": "Amari matek, Maa." },
    "s21-nkusubwa": { "text": "Apari, lawota." },
    "s21-tokaaba": { "text": "Pe ikok, latina." },
    "s-pole-sana": { "text": "Cwinya cwer piri matek!" },
    "s-samahani-daktari": { "text": "Kica, daktar." },
    "s-nimechoka-sana": { "text": "Aol matek." },
    "s-nina-furaha": { "text": "Tin atye ki yomcwiny!" },
    "s-siku-ya-furaha": { "text": "Obedo nino me yomcwiny." },
    "s-nina-huzuni": { "text": "Atye ki cwercwiny." },
    "s-nimefurahi-sana": { "text": "Cwinya yom tutwal!" },
    "s-nimeshangaa": { "text": "Aur tutwal!" },
    "s-bosi-hasira": { "text": "Bos tye ki akemo." },
    "s-nimekasirika": { "text": "Cwinya owang matek!" },
    "s-naogopa-mbwa": { "text": "Alworo gwok." },
    "s-usijali": { "text": "Pe iparo, peko pe." },
    "s-nakupenda-bibi": { "text": "Amari, Adaa." },
    "s-hongera-mtihani": { "text": "Itimo maber i tem!" },
    "s-bahati-njema": { "text": "Gum maber diki!" }
  },
  "phrases": [
    "Tin cwinya yom matek!",
    "Itye maber, lawota?",
    "Aol matek.",
    "Aparo i kom tem.",
    "Cwinya cwer piri! Cang oyot.",
    "Timwa kica, abino lacen.",
    "Apari."
  ],
  "dialogues": {
    "u21s2l3": [{ "line": "Itye maber? Inen ni iol.", "options": ["Eyo, aol matek. Tin atiyo matek.", "Yom cwinya me neni.", "Pe ikok."] }],
    "u21s3l3": [{ "line": "Cwinya cwer. Adaa two.", "options": ["Cwinya cwer piri! Abilimo en.", "Cwinya yom matek!", "Cwinya owang."] }]
  }
}
