{
  "$schema": "../../../../../docs/packs/schema/lang-unit.schema.json",
  "id": "u19",
  "words": {
    "ndidde": { "text": "Abu anyam" },
    "nnywedde": { "text": "Abu amat" },
    "olidde": { "text": "Abu inyam bo?" },
    "nkoze": { "text": "Abu asuam" },
    "nsomye": { "text": "Abu asom" },
    "mmaze": { "text": "Abu adiar" },
    "nnagenda": { "text": "Alosit" },
    "nnalya": { "text": "Anyamit" },
    "nnasoma": { "text": "Asomit" },
    "twagenda": { "text": "ilosit oni" },
    "yagenda": { "text": "elosit" },
    "nnali": { "text": "Ajaasit" },
    "edda": { "text": "ŋolo kaŋulu" },
    "wiiki-ewedde": { "text": "asabiti ŋina abu elosi" },
    "omwaka-oguwedde": { "text": "ekaru ŋina abu elosi" },
    "nkyali": { "text": "Ejai eoŋ bobo" },
    "fua": { "text": "Kilopi" },
    "sasa-hivi": { "text": "kolo diŋ" },
    "tayari": { "text": "abu daŋ" },
    "sijala": { "text": "Mam anyamit bobo" },
    "nilifanya": { "text": "Asuamit" },
    "ulifanya": { "text": "isuamit" },
    "walifika": { "text": "edoŋit kesi" },
    "juzi": { "text": "ŋolo diŋ" },
    "nilinunua": { "text": "Agwelit" },
    "niliona": { "text": "Aanyunit" }
  },
  "sentences": {
    "s19-ndidde-matooke": { "text": "Abu anyam amatooke." },
    "s19-nnywedde-caayi": { "text": "Abu amat icai." },
    "s19-olidde": { "text": "Abu inyam bo? Ee, abu anyam." },
    "s19-nkoze-nnyo": { "text": "Lolo abu asuam noi." },
    "s19-nsomye-ekitabo": { "text": "Abu asom ekitabo." },
    "s19-mmaze": { "text": "Abu adiar aswam kaŋ." },
    "s19-jjo-nnagenda": { "text": "Ŋolo alosit ko etaun." },
    "s19-jjo-nnalya": { "text": "Ŋolo anyamit akiriŋ." },
    "s19-nnasoma": { "text": "Asomit Aingereza ko esukul." },
    "s19-twagenda-jinja": { "text": "Asabiti ŋina abu elosi ilosit oni ko {@getaway}." },
    "s19-yagenda-awaka": { "text": "Toto elosit ore." },
    "s19-edda-nnali": { "text": "Ŋolo kaŋulu ajaasit esomaran." },
    "s19-omwaka-oguwedde": { "text": "Ekaru ŋina abu elosi ajaasit ko {@hometown}." },
    "s19-nkyali-muyizi": { "text": "Ejai eoŋ bobo esomaran." },
    "s-osha-vyombo": { "text": "Kilop itabaon kolo diŋ!" },
    "s-fua-nguo": { "text": "Kilopi inanga lolo." },
    "s-nimemaliza": { "text": "Abu adiar!" },
    "s-nilikuwa-nyumbani": { "text": "Ŋolo ajaasit ore." },
    "s-zamani-sana": { "text": "Abu ejai ŋolo kaŋulu noi." },
    "s-nimekula-asante": { "text": "Abu anyam, eyalama." },
    "s-tayari-nimekula": { "text": "Abu daŋ anyam." },
    "s-bado-sijala": { "text": "Mam anyamit bobo." },
    "s-nilienda-sokoni": { "text": "Ŋolo alosit ko ocuga." },
    "s-nilikula-wali": { "text": "Anyamit omuceele ka imare." },
    "s-ulifanya-nini": { "text": "Isuamit inyo ŋolo?" },
    "s-nilifanya-kazi": { "text": "Asuamit aswam lo ore." },
    "s-neema-alienda": { "text": "{@amara} elosit ko esukul." },
    "s-tulienda-mombasa": { "text": "Ilosit oni ko {@getaway} ko ebasi." },
    "s-walifika-jana": { "text": "Idwe edoŋit ŋolo." },
    "s-juzi-nilinunua": { "text": "Ŋolo diŋ agwelit ilwatin." },
    "s-niliona-tembo": { "text": "Asabiti ŋina abu elosi aanyunit etome!" },
    "s-mwaka-jana-zanzibar": { "text": "Ekaru ŋina abu elosi ilosit oni ko {@island}." }
  },
  "phrases": [
    "Abu inyam bo? Ee, abu anyam.",
    "Lolo abu asuam noi.",
    "Abu adiar aswam kaŋ.",
    "Ŋolo alosit ko etaun.",
    "Asabiti ŋina abu elosi ilosit oni ko {@getaway}.",
    "Ŋolo kaŋulu ajaasit esomaran."
  ],
  "dialogues": { "u19s3l3": [{ "line": "Isuamit inyo ŋolo?", "options": ["Alosit ko etaun.", "Abeit alosit moi.", "Mam anyami akiriŋ."] }] },
  "stories": {}
}
