{
  "$schema": "../../../../../docs/packs/schema/lang-unit.schema.json",
  "id": "u7",
  "words": {
    "ennyumba": { "text": "ennyumba" },
    "ekisenge": { "text": "ekisenge" },
    "effumbiro": { "text": "effumbiro" },
    "oluggi": { "text": "oluggi" },
    "eddirisa": { "text": "eddirisa" },
    "entebe": { "text": "entebe" },
    "emmeeza": { "text": "emmeeza" },
    "ettaala": { "text": "ettaala" },
    "kkodi": { "text": "Kkodi!" },
    "yingira": { "text": "Yingira" },
    "tuula": { "text": "Tuula" },
    "wansi": { "text": "wansi" },
    "tusanyuse": { "text": "Tusanyuse" },
    "ggalawo": { "text": "Ggalawo" },
    "ggulawo": { "text": "Ggulawo" },
    "ndeetera": { "text": "Ndeetera" },
    "mpa": { "text": "Mpa" },
    "ssaako": { "text": "Ssaako" }
  },
  "sentences": {
    "s-ennyumba-yange": { "text": "Ennyumba yange." },
    "s-ekisenge-kyange": { "text": "Ekisenge kyange." },
    "s-maama-mu-ffumbiro": { "text": "Maama ali mu ffumbiro." },
    "s-kkodi-yingira": { "text": "Kkodi! Yingira!" },
    "s-tuula-wansi": { "text": "Tuula wansi." },
    "s-tuula-ku-ntebe": { "text": "Tuula ku ntebe." },
    "s-tusanyuse-okukulaba": { "text": "Tusanyuse okukulaba." },
    "s-ggalawo-oluggi": { "text": "Ggalawo oluggi." },
    "s-ggulawo-eddirisa": { "text": "Ggulawo eddirisa." },
    "s-ndeetera-amazzi": { "text": "Ndeetera amazzi." },
    "s-mpa-ekikopo": { "text": "Mpa ekikopo." },
    "s-ssaako-ettaala": { "text": "Ssaako ettaala." }
  },
  "phrases": ["Kkodi!", "Yingira!", "Tuula wansi.", "Tusanyuse okukulaba.", "Ggalawo oluggi.", "Ndeetera amazzi."],
  "dialogues": { "u7s2l2": [{ "line": "Kkodi!", "options": ["Yingira! Tusanyuse okukulaba.", "Ggalawo oluggi.", "Ssaawa mmeka?"] }] }
}
