{
  "$schema": "../../../../../docs/packs/schema/lang-unit.schema.json",
  "id": "u9",
  "words": {
    "langi": { "text": "rangi" },
    "kimyufu": { "text": "ika" },
    "kiddugavu": { "text": "ini" },
    "kyeru": { "text": "ewaru" },
    "kiragala": { "text": "aya" },
    "kyenvu": { "text": "ndriku" },
    "bbulu": { "text": "bulu" },
    "kitaka": { "text": "ombe" },
    "kakobe": { "text": "anyi" },
    "kinene": { "text": "amboa" },
    "kitono": { "text": "mvaa" },
    "kiggya": { "text": "onyiru" },
    "kikadde": { "text": "ndra'bo" },
    "kirungi": { "text": "muke" },
    "kibi": { "text": "onzi" },
    "mulungi": { "text": "aradu" },
    "muwanvu": { "text": "ndu" },
    "mumpi": { "text": "ambi" },
    "muto": { "text": "ndriza" },
    "mukadde": { "text": "aa" },
    "munene": { "text": "amboa" },
    "balungi": { "text": "muke" },
    "bawanvu": { "text": "ndu" },
    "safi": { "text": "uru" },
    "chafu": { "text": "ozoru" },
    "gani": { "text": "ngo" },
    "kabisa": { "text": "ndra ndra" },
    "nzito": { "text": "ndri" },
    "nyepesi": { "text": "pa" },
    "mwembamba": { "text": "kiri" },
    "mpole": { "text": "ovu tre" },
    "mchangamfu": { "text": "asi muke" }
  },
  "sentences": {
    "s-ekikopo-kimyufu": { "text": "Kikombe ika." },
    "s-ekitabo-kiddugavu": { "text": "Buku ini." },
    "s-ekitanda-kyeru": { "text": "Kitanda ewaru." },
    "s-langi-ki": { "text": "Rangi ngo?" },
    "s-ekitabo-kya-kiragala": { "text": "Buku aya." },
    "s-ekikopo-kya-bbulu": { "text": "Kikombe bulu." },
    "s-emmeeza-ya-kitaka": { "text": "Meza ombe." },
    "s-njagala-ekikopo-ekimyufu": { "text": "Ma le kikombe ika." },
    "s-ekibuga-kinene": { "text": "Taun amboa." },
    "s-ekikopo-kitono": { "text": "Kikombe mvaa." },
    "s-ekitabo-kiggya": { "text": "Buku onyiru." },
    "s-ekitanda-kikadde": { "text": "Kitanda ndra'bo." },
    "s-kirungi-nnyo": { "text": "Eri muke ndra!" },
    "s-kino-kibi": { "text": "Nde onzi." },
    "s-omukazi-mulungi": { "text": "Oku aradu." },
    "s-omusajja-muwanvu": { "text": "Agupi ndu." },
    "s-ndi-mumpi": { "text": "Ma ambi." },
    "s-omwana-muto": { "text": "Mva ndriza." },
    "s-jjajja-mukadde": { "text": "Dede aa." },
    "s-abaana-balungi": { "text": "Anzi muke." },
    "s-abasomesa-bawanvu": { "text": "Malimuyi ndu." },
    "s-baba-yako-mrefu": { "text": "Mi ati ndu." },
    "s-mtoto-mfupi": { "text": "Mva ambi." },
    "s-mtu-mzuri": { "text": "Dede ni ba muke." },
    "s-mwalimu-wake": { "text": "Eri malimu muke." },
    "s-mlango-mwekundu": { "text": "Dera ika." },
    "s-rangi-gani": { "text": "Eri rangi ngo?" },
    "s-nyumba-nyeupe": { "text": "Jo ewaru." },
    "s-rangi-ya-kijani": { "text": "Dirisa rangi ni aya." },
    "s-nyumba-mpya": { "text": "Ma jo onyiru." },
    "s-meza-chafu": { "text": "Meza ozoru." },
    "s-si-mbaya": { "text": "Eri onzi ku." },
    "s-kikombe-gani": { "text": "Kikombe ngo?" },
    "s-mpya-kabisa": { "text": "Eri onyiru ndra ndra!" },
    "s-safi-kabisa": { "text": "Muke ndra ndra!" },
    "s-watoto-wazuri": { "text": "Anzi muke." },
    "s-kikombe-kikubwa": { "text": "Kikombe amboa." },
    "s-vikombe-vidogo": { "text": "Kikombeyi mvaa." },
    "s-meza-nzito": { "text": "Meza ndri." },
    "s-ni-nyepesi": { "text": "Eri pa ndra." },
    "s-dada-mrembo": { "text": "Mi amvipi aradu." },
    "s-mwalimu-hodari": { "text": "Malimu ni afa ndra." },
    "s-kaka-mwembamba": { "text": "Ma adripi kiri." },
    "s-bibi-mpole": { "text": "Dede ovu tre ndra." },
    "s-neema-mchangamfu": { "text": "{@amara} asi muke." }
  },
  "phrases": ["Rangi ngo?", "Kikombe ika.", "Buku aya.", "Ma le kikombe ika.", "Eri muke ndra!", "Oku aradu.", "Anzi muke."],
  "dialogues": {
    "u9s2l3": [{ "line": "Mi buku rangi ngo?", "options": ["Ini.", "Ndu.", "Ma le nyaka."] }],
    "u9s3l3": [{ "line": "Mi ati ndu ya?", "options": ["Ku, eri ambi.", "Ii, eri ika.", "Buku onyiru."] }]
  },
  "stories": {}
}
