{
  "$schema": "../../../../../docs/packs/schema/lang-unit.schema.json",
  "id": "u32",
  "words": {
    "ennyanja": { "text": "anyanza" },
    "nnalubaale": { "text": "Anyanza Nalubaale" },
    "omugga": { "text": "akare" },
    "kiyira": { "text": "Akare Nile" },
    "ekibira": { "text": "ateŋ" },
    "omuti": { "text": "ekitoi" },
    "emiti": { "text": "ikito" },
    "olusozi": { "text": "emoru" },
    "ensozi": { "text": "imoru" },
    "ebimuli": { "text": "ŋakaboli" },
    "ettaka": { "text": "akwap" },
    "okusimba": { "text": "akipor ikito" },
    "okukuuma": { "text": "akiyun" },
    "kasasiro": { "text": "ŋakaturi" },
    "tosuula": { "text": "Mam ibili" },
    "mlima": { "text": "emoru ŋina ewoko" },
    "mazingira": { "text": "ŋibore ŋulu elukuni" },
    "tutunze": { "text": "Kiyunata oni" },
    "kupanda-miti": { "text": "akipor ikito lu" }
  },
  "sentences": {
    "s32-ennyanja-nnene": { "text": "Anyanza Nalubaale ka anyanza epolot." },
    "s32-ebyennyanja": { "text": "Ikolia elomete kotoma anyanza." },
    "s32-omugga-kiyira": { "text": "Akare Nile ka akare ŋina elwana." },
    "s32-kiyira-jinja": { "text": "Akare Nile ekiŋaren Jinja." },
    "s32-ekibira": { "text": "Ŋaŋoroi ejaasi kotoma ateŋ." },
    "s32-omuti-omunene": { "text": "Ekitoi na epolot noi." },
    "s32-ensozi-musanvu": { "text": "Kampala ejaasi imoru ikanyarei." },
    "s32-ku-lusozi": { "text": "Ekal kaŋ ejai kuju ka emoru." },
    "s32-ebimuli": { "text": "Ŋakaboli ejokak noi." },
    "s32-tusimbe-emiti": { "text": "Kiporata oni ikito!" },
    "s32-tukuume-ettaka": { "text": "Kiyunata oni akwap wok." },
    "s32-tosuula-kasasiro": { "text": "Mam ibili ŋakaturi ne!" },
    "s-kilimanjaro": { "text": "Kilimanjaro ka emoru ŋina ewoko noi kotoma Afrika." },
    "s-ziwa-victoria": { "text": "Anyanza Victoria epolot noi." },
    "s-mto-nile": { "text": "Akare Nile ekiŋaren kotoma Uganda." },
    "s-msitu": { "text": "Ateŋ ejaasi ikito ŋulu ipu." },
    "s-maua": { "text": "Ŋakaboli ejokak." },
    "s-ardhi": { "text": "Akwap abu eokok." },
    "s-tutunze": { "text": "Kiyunata oni ŋibore ŋulu elukuni oni." },
    "s-kupanda-miti": { "text": "Esukul eporei ikito ŋinikaru." }
  },
  "phrases": [
    "Anyanza Nalubaale ka anyanza epolot.",
    "Akare Nile ekiŋaren {@getaway}.",
    "Ŋaŋoroi ejaasi kotoma ateŋ.",
    "{@city} ejaasi imoru ikanyarei.",
    "Kiporata oni ikito!",
    "Mam ibili ŋakaturi ne!"
  ],
  "dialogues": {
    "u32s3l3": [
      {
        "line": "Isuamata oni inyo kanuka akiyun akwap?",
        "options": ["Kiporata oni ikito, mam ibili ŋakaturi.", "Kitolomaa ŋinipak Kabaka!", "Amatakini aituk akipi."]
      }
    ]
  },
  "stories": {
    "source-of-nile": {
      "title": "Aiŋarenit ka Akare Nile",
      "summary": "{@ssali} eyauni {@emma} akiŋar ne ekiŋaren Akare Nile.",
      "lines": [
        "Abu ibunete oni {@getaway}! Kiŋar, Akare Nile.",
        "Akare Nile ekiŋaren ai?",
        "Ne! Akipi elomuni kotoma Anyanza Victoria.",
        "Ŋini ka inyo ekeny ŋini?",
        "Ŋini ka ewalu! Erapi kuju ka akare.",
        "Ŋakaboli ka ikito ejokak noi ne.",
        "Ee. Konye kiŋar, ŋakaturi kotoma aokot.",
        "Kiyunata oni akwap wok! Kiriamata oni ŋakaturi.",
        "Ejok noi, {@emma}!"
      ],
      "questions": [
        { "question": "Akipi ka Akare Nile elomuni ai?", "options": ["Anyanza Victoria", "Ateŋ", "Akiru bon"] },
        { "question": "{@ssali} eŋari inyo kotoma aokot?", "options": ["Ŋakaturi", "Engatuny", "Ebato"] },
        {
          "question": "{@emma} ebala ekwaŋ “Kiyunata oni akwap wok”?",
          "options": ["Kiyunata oni akwap wok", "Mam ibili ŋakaturi", "Kiporata oni ikito"]
        }
      ]
    }
  }
}
