{
  "$schema": "../../../../../docs/packs/schema/lang-unit.schema.json",
  "id": "u11",
  "words": {
    "nzuukuka": { "text": "Ninsisimuka", "alts": ["Nimsisimuka"] },
    "ngolokoka": { "text": "Ninyimuka" },
    "ekyenkya": { "text": "ekyanyenkya", "alts": ["eky'anyenkya"] },
    "buli-lunaku": { "text": "buri izooba", "alts": ["buri eizooba"] },
    "omulimu": { "text": "omurimo" },
    "nkola": { "text": "Ninkora" },
    "akola": { "text": "naakora" },
    "tukola": { "text": "nitukora" },
    "bakola": { "text": "nibakora" },
    "ekyemisana": { "text": "eky'omu ihangwe", "alts": ["ekyomu ihangwe"] },
    "nfumba": { "text": "Ninteeka" },
    "njoza": { "text": "Ninyoza" },
    "okusoma": { "text": "kusoma" },
    "okuzannya": { "text": "kuzaana" },
    "bazannya": { "text": "nibazaana" },
    "oluvannyuma": { "text": "bwanyima", "alts": ["hanyuma"] },
    "ekyeggulo": { "text": "ekyakyeigoro", "alts": ["eky'akyeigoro"] },
    "ndaba": { "text": "Nindeeba" },
    "ttivvi": { "text": "tiivi", "alts": ["tivi"] },
    "nneebaka": { "text": "Nimbyama" },
    "bulijjo": { "text": "buriijo" },
    "ninapenda": { "text": "Ninkunda" },
    "muziki": { "text": "ebyemiziki", "alts": ["omuziki"] },
    "safisha": { "text": "Yonja" },
    "fagia": { "text": "Kombera" },
    "osha": { "text": "Yoza" },
    "vyombo": { "text": "ebisahani" },
    "msaada": { "text": "obuhwezi" },
    "kazi-nzuri": { "text": "Waakora gye!", "alts": ["Wakora gye!"] }
  },
  "sentences": {
    "s-nzuukuka-ku-makya": { "text": "Ninsisimuka nyenkyakare." },
    "s-ngolokoka-ssaawa-emu": { "text": "Ninyimuka shaaha emwe." },
    "s-ndya-ekyenkya": { "text": "Ninda ekyanyenkya." },
    "s-nkola-buli-lunaku": { "text": "Ninkora buri izooba." },
    "s-nnenda-ku-mulimu": { "text": "Ningyenda aha murimo." },
    "s-maama-akola-mu-ddwaliro": { "text": "Maama naakorera omu irwariro." },
    "s-tukola-awaka": { "text": "Nitukorera omuka." },
    "s-bakola-mu-kibuga": { "text": "Nibakorera omu rurembo." },
    "s-nfumba-ekyemisana": { "text": "Ninteeka eky'omu ihangwe." },
    "s-njoza-engoye": { "text": "Ninyoza emyenda." },
    "s-njagala-okusoma": { "text": "Ninyenda kusoma." },
    "s-abaana-bazannya": { "text": "Abaana nibazaana." },
    "s-oluvannyuma-nsoma": { "text": "Bwanyima ninsoma." },
    "s-ndya-ekyeggulo": { "text": "Ninda ekyakyeigoro ekiro." },
    "s-ndaba-ttivvi": { "text": "Nindeeba tiivi omu ihangwe." },
    "s-nneebaka-ssaawa-ssatu": { "text": "Nimbyama shaaha ishatu z'ekiro." },
    "s-bulijjo-nnywa-caayi": { "text": "Buriijo ninywa caai." },
    "s-ninaamka-saa-kumi-na-mbili": { "text": "Ninsisimuka shaaha ikumi na ibiri." },
    "s-ninasoma-jioni": { "text": "Ninsoma orweigoro." },
    "s-ninapika-wali": { "text": "Ninteeka omuceri n'ebishyimbo." },
    "s-ninalala-usiku": { "text": "Nimbyama shaaha ina z'ekiro." },
    "s-ninapenda-kucheza-mpira": { "text": "Ninkunda kuzaana omupiira." },
    "s-ninapenda-muziki": { "text": "Ninkunda ebyemiziki." },
    "s-safisha-chumba": { "text": "Yonja ekisiika." },
    "s-fagia-nje": { "text": "Kombera aheeru." },
    "s-osha-vyombo-tafadhali": { "text": "Yoza ebisahani, ninkushaba." },
    "s-asante-msaada": { "text": "Webale obuhwezi!" },
    "s-kazi-nzuri": { "text": "Waakora gye, {@amara}!" },
    "s-tukutane-sokoni": { "text": "Tubuganire omu katare." },
    "s-tukutane-saa-ngapi": { "text": "Tubugane shaaha zingahi?" },
    "s-tutaonana-baadaye": { "text": "Turaareebana bwanyima." }
  },
  "phrases": [
    "Ninsisimuka nyenkyakare.",
    "Ninda ekyanyenkya.",
    "Ningyenda aha murimo.",
    "Maama naakorera omu irwariro.",
    "Abaana nibazaana.",
    "Bwanyima ninsoma.",
    "Nimbyama shaaha ishatu z'ekiro."
  ],
  "dialogues": {
    "u11s3l3": [{ "line": "Nookora ki nyenkyakare?", "options": ["Ninsisimuka, naarya ekyanyenkya.", "Nimbyama ekiro.", "Eshaati yangye."] }]
  }
}
