{
  "$schema": "../../../../../docs/packs/schema/lang-unit.schema.json",
  "id": "u9",
  "words": {
    "langi": { "text": "ekala" },
    "kimyufu": { "text": "arengan" },
    "kiddugavu": { "text": "akiryon" },
    "kyeru": { "text": "akwangan" },
    "kiragala": { "text": "akijani" },
    "kyenvu": { "text": "ayelo" },
    "bbulu": { "text": "ebulu" },
    "kitaka": { "text": "ekahawia" },
    "kakobe": { "text": "epapo" },
    "kinene": { "text": "epolon" },
    "kitono": { "text": "ediit" },
    "kiggya": { "text": "ititaŋ" },
    "kikadde": { "text": "akaru" },
    "kirungi": { "text": "ejok" },
    "kibi": { "text": "erono" },
    "mulungi": { "text": "ajokan" },
    "muwanvu": { "text": "ewoyan" },
    "mumpi": { "text": "ekutan" },
    "muto": { "text": "ebiro" },
    "mukadde": { "text": "ekasukout" },
    "munene": { "text": "epolon" },
    "balungi": { "text": "ejok" },
    "bawanvu": { "text": "ewoyak" },
    "safi": { "text": "esegan" },
    "chafu": { "text": "ecil" },
    "gani": { "text": "ŋai" },
    "kabisa": { "text": "jwi" },
    "nzito": { "text": "edit" },
    "nyepesi": { "text": "epupu" },
    "mwembamba": { "text": "ekesek" },
    "mpole": { "text": "epuc" },
    "mchangamfu": { "text": "elakara" }
  },
  "sentences": {
    "s-ekikopo-kimyufu": { "text": "Ekopo arengan." },
    "s-ekitabo-kiddugavu": { "text": "Ekitabo akiryon." },
    "s-ekitanda-kyeru": { "text": "Ekitanda akwangan." },
    "s-langi-ki": { "text": "Ekala ŋai?" },
    "s-ekitabo-kya-kiragala": { "text": "Ekitabo akijani." },
    "s-ekikopo-kya-bbulu": { "text": "Ekopo ebulu." },
    "s-emmeeza-ya-kitaka": { "text": "Emeeza ekahawia." },
    "s-njagala-ekikopo-ekimyufu": { "text": "Amina ekopo arengan." },
    "s-ekibuga-kinene": { "text": "Etaun epolon." },
    "s-ekikopo-kitono": { "text": "Ekopo ediit." },
    "s-ekitabo-kiggya": { "text": "Ekitabo ititaŋ." },
    "s-ekitanda-kikadde": { "text": "Ekitanda akaru." },
    "s-kirungi-nnyo": { "text": "Ejok noi!" },
    "s-kino-kibi": { "text": "Lo erono." },
    "s-omukazi-mulungi": { "text": "Aberu ajokan." },
    "s-omusajja-muwanvu": { "text": "Ekile ewoyan." },
    "s-ndi-mumpi": { "text": "Eoŋ ekutan." },
    "s-omwana-muto": { "text": "Ikoku ebiro." },
    "s-jjajja-mukadde": { "text": "Tata ekasukout." },
    "s-abaana-balungi": { "text": "Idwe ejok." },
    "s-abasomesa-bawanvu": { "text": "Ikesiauok ewoyak." },
    "s-baba-yako-mrefu": { "text": "Papa kon ewoyan." },
    "s-mtoto-mfupi": { "text": "Ikoku ekutan." },
    "s-mtu-mzuri": { "text": "Tata ka etuŋanan lo ejok." },
    "s-mwalimu-wake": { "text": "Ekesiaunan keŋ ejok." },
    "s-mlango-mwekundu": { "text": "Ekek arengan." },
    "s-rangi-gani": { "text": "Ekala keŋ ŋai?" },
    "s-nyumba-nyeupe": { "text": "Etogo akwangan." },
    "s-rangi-ya-kijani": { "text": "Ekala ka edirisa akijani." },
    "s-nyumba-mpya": { "text": "Etogo kaŋ ititaŋ." },
    "s-meza-chafu": { "text": "Emeeza ecil." },
    "s-si-mbaya": { "text": "Mam erono." },
    "s-kikombe-gani": { "text": "Ekopo ŋai?" },
    "s-mpya-kabisa": { "text": "Ititaŋ jwi!" },
    "s-safi-kabisa": { "text": "Ejok jwi!" },
    "s-watoto-wazuri": { "text": "Idwe luejok." },
    "s-kikombe-kikubwa": { "text": "Ekopo epolon." },
    "s-vikombe-vidogo": { "text": "Ikopoi luediit." },
    "s-meza-nzito": { "text": "Emeeza edit." },
    "s-ni-nyepesi": { "text": "Epupu noi." },
    "s-dada-mrembo": { "text": "Inac kon ajokan." },
    "s-mwalimu-hodari": { "text": "Ekesiaunan ecoit noi." },
    "s-kaka-mwembamba": { "text": "Onac kaŋ ekesek." },
    "s-bibi-mpole": { "text": "Tata epuc noi." },
    "s-neema-mchangamfu": { "text": "{@amara} elakara." }
  },
  "phrases": ["Ekala ŋai?", "Ekopo arengan.", "Ekitabo akijani.", "Amina ekopo arengan.", "Ejok noi!", "Aberu ajokan.", "Idwe ejok."],
  "dialogues": {
    "u9s2l3": [{ "line": "Ekitabo kon ekala ŋai?", "options": ["Akiryon.", "Ewoyan.", "Ejaasi kaŋ akoro."] }],
    "u9s3l3": [{ "line": "Papa kon ewoyan bo?", "options": ["Mam, ŋesi ekutan.", "Ee, arengan.", "Ekitabo ititaŋ."] }]
  },
  "stories": {}
}
