{
  "$schema": "../../../../../docs/packs/schema/lang-unit.schema.json",
  "id": "u33",
  "words": {
    "okusinga": { "text": "plus que", "alts": ["que", "dépasser", "surpasser"] },
    "asinga": { "text": "est le plus", "alts": ["est la plus", "dépasse", "est plus", "surpasse"] },
    "kisinga": { "text": "est plus", "alts": ["est le plus", "est la plus", "dépasse"] },
    "obuwanvu": { "text": "taille", "alts": ["hauteur", "longueur", "grandeur"] },
    "obunene": { "text": "grosseur", "alts": ["taille", "grandeur", "dimension"] },
    "obulungi": { "text": "bonté", "alts": ["beauté", "qualité"] },
    "ekisinga": { "text": "le plus", "alts": ["la plus", "le meilleur", "la meilleure"] },
    "okusinga-byonna": { "text": "par-dessus tout", "alts": ["plus que tout", "surtout"] },
    "kye-kimu": { "text": "pareil", "alts": ["c’est pareil", "c’est la même chose", "la même chose"] },
    "enjawulo": { "text": "différence", "alts": ["la différence", "différent", "différemment"] },
    "afaanana": { "text": "ressemble à", "alts": ["il ressemble à", "elle ressemble à"] },
    "nga": { "text": "comme", "alts": ["tel que", "si"] },
    "zaidi": { "text": "plus", "alts": ["davantage", "le plus"] },
    "kuliko-wote": { "text": "le plus de tous", "alts": ["de tous", "que tous", "le plus"] },
    "sawa-na": { "text": "pareil que", "alts": ["comme", "égal à", "le même que"] },
    "bora": { "text": "meilleur", "alts": ["meilleure", "le meilleur", "excellent"] },
    "kidogo-zaidi": { "text": "moins", "alts": ["un peu moins"] },
    "mali": { "text": "richesse", "alts": ["richesses", "biens", "fortune"] }
  },
  "sentences": {
    "s33-enjovu-okusinga-ente": {
      "text": "Un éléphant est plus grand qu’une vache.",
      "alts": ["L’éléphant est plus grand que la vache.", "Les éléphants sont plus grands que les vaches."]
    },
    "s33-kampala-okusinga-masaka": { "text": "{@city} est plus grande que {@hometown}.", "alts": ["{@city} est plus grand que {@hometown}."] },
    "s33-ani-asinga-obuwanvu": { "text": "Qui est le plus grand ?", "alts": ["Qui est la plus grande ?", "Qui est plus grand ?"] },
    "s33-ssali-asinga": { "text": "{@ssali} est le plus grand." },
    "s33-kisinga-obunene": { "text": "Ce livre est le plus grand.", "alts": ["Ce livre est plus grand.", "Ce livre est le plus gros."] },
    "s33-ekisinga-obulungi": { "text": "C’est le meilleur.", "alts": ["C’est la meilleure.", "Celui-ci est le meilleur."] },
    "s33-njagala-matooke-okusinga-byonna": { "text": "J’aime le matooke plus que tout.", "alts": ["J’aime le matooke par-dessus tout.", "J’adore le matooke plus que tout."] },
    "s33-kye-kimu": { "text": "Ces deux-là sont pareils.", "alts": ["Les deux sont pareils.", "C’est la même chose."] },
    "s33-si-kye-kimu": { "text": "Ce n’est pas pareil !", "alts": ["Ce n’est pas la même chose !", "C’est pas pareil !"] },
    "s33-enjawulo": { "text": "Où est la différence ?", "alts": ["Quelle est la différence ?", "C’est quoi, la différence ?"] },
    "s33-afaanana-maama-we": { "text": "Elle ressemble à sa mère.", "alts": ["Il ressemble à sa mère."] },
    "s-kuliko": { "text": "L’éléphant est plus grand que le lion.", "alts": ["Un éléphant est plus grand qu’un lion."] },
    "s-zaidi": { "text": "{@amara} est plus grande.", "alts": ["{@amara} est la plus grande.", "{@amara} est plus grand."] },
    "s-kuliko-wote": { "text": "Le Kilimandjaro est le plus haut de tous.", "alts": ["Le Kilimandjaro est la plus haute de toutes."] },
    "s-sawa-na": { "text": "Ma tasse est pareille que la tienne.", "alts": ["Ma tasse est la même que la tienne.", "Ma tasse est comme la tienne."] },
    "s-tofauti": { "text": "Le swahili et l’anglais sont différents." },
    "s-kama": { "text": "Elle chante comme un oiseau.", "alts": ["Il chante comme un oiseau."] },
    "s-bora": { "text": "La santé vaut mieux que la richesse.", "alts": ["La santé est meilleure que la richesse."] },
    "s-kidogo-zaidi": { "text": "Aujourd’hui, il y a moins de pluie.", "alts": ["Il pleut moins aujourd’hui.", "Il y a moins de pluie aujourd’hui."] }
  },
  "phrases": [
    "Un éléphant est plus grand qu’une vache.",
    "Qui est le plus grand ?",
    "C’est le meilleur.",
    "J’aime le matooke plus que tout.",
    "Ce n’est pas pareil !",
    "Elle ressemble à sa mère."
  ],
  "dialogues": {
    "u33s2l3": [
      {
        "line": "Qu’est-ce que tu aimes plus que tout ?",
        "options": ["J’aime les chansons plus que tout.", "Ce n’est pas pareil.", "L’éléphant est grand."]
      }
    ]
  },
  "stories": {
    "sw-who-is-faster": {
      "title": "Qui est le plus rapide ?",
      "summary": "Neema et Amani se disputent pour savoir qui court le plus vite.",
      "lines": [
        "Amani, je suis plus rapide que toi !",
        "Pas vrai ! C’est moi, la plus rapide.",
        "Alors faisons la course jusqu’à cet arbre.",
        "Un, deux, trois… partez !",
        "J’ai gagné ! Je suis la plus rapide de toutes !"
      ],
      "questions": [
        {
          "question": "Pourquoi se disputent-elles ?",
          "options": ["Qui est la plus rapide", "Qui est la plus grande", "Qui est la plus âgée"]
        },
        { "question": "Qui a gagné ?", "options": ["Neema", "Amani", "Personne"] },
        { "question": "Comment Neema dit-elle « que » (dans une comparaison) ?", "options": ["que", "plus", "pareil que"] }
      ]
    }
  }
}
