{
  "$schema": "../../../../../docs/packs/schema/lang-unit.schema.json",
  "id": "u37",
  "words": {
    "amawulire": { "text": "news", "alts": ["the news"] },
    "owulidde": { "text": "Have you heard", "alts": ["did you hear", "you have heard"] },
    "leediyo": { "text": "radio", "alts": ["the radio"] },
    "nti": { "text": "that" },
    "agamba": { "text": "he says", "alts": ["she says", "he/she says", "says"] },
    "bagamba": { "text": "they say", "alts": ["people say"] },
    "olukiiko": { "text": "meeting", "alts": ["council", "the meeting", "assembly", "conference"] },
    "ssentebe": { "text": "chairperson", "alts": ["chairman", "chair", "the chairperson"] },
    "ndowooza": { "text": "I think", "alts": ["i believe", "i suppose", "i guess"] },
    "endowooza": { "text": "opinion", "alts": ["idea", "view", "thought", "the opinion", "opinions", "views", "comments"] },
    "nzikiriza": { "text": "I agree", "alts": ["i accept", "i believe"] },
    "sikkiriza": { "text": "I don’t agree", "alts": ["i disagree", "i do not agree", "i don’t accept"] },
    "jamii": { "text": "community", "alts": ["society", "the community"] },
    "kiongozi": { "text": "leader", "alts": ["the leader"] },
    "serikali": { "text": "government", "alts": ["the government"] },
    "uchaguzi": { "text": "election", "alts": ["elections", "the election"] },
    "kura": { "text": "vote", "alts": ["votes", "ballot"] },
    "harambee": { "text": "harambee", "alts": ["pulling together", "fundraiser", "let’s pull together"] },
    "tusaidiane": { "text": "Let’s help each other", "alts": ["let us help one another", "let’s help one another"] },
    "tunapendana": { "text": "we love each other", "alts": ["we love one another"] },
    "gazeti": { "text": "newspaper", "alts": ["the newspaper", "paper"] },
    "taarifa-ya-habari": { "text": "the news", "alts": ["news bulletin", "the news bulletin"] },
    "tukio": { "text": "event", "alts": ["incident", "the event"] },
    "tatizo": { "text": "problem", "alts": ["the problem", "issue"] },
    "suluhisho": { "text": "solution", "alts": ["the solution", "answer"] },
    "kwa-maoni-yangu": { "text": "in my opinion", "alts": ["in my view"] },
    "muhimu": { "text": "important", "alts": ["necessary", "essential"] }
  },
  "sentences": {
    "s37-owulidde-amawulire": { "text": "Have you heard the news?", "alts": ["Did you hear the news?"] },
    "s37-ku-leediyo": { "text": "I heard it on the radio.", "alts": ["I have heard it on the radio.", "I heard on the radio."] },
    "s37-agamba-nti": {
      "text": "He says that rain is coming.",
      "alts": ["She says that rain is coming.", "He says rain is coming.", "She says the rain is coming."]
    },
    "s37-bagamba-nti": {
      "text": "They say that the new road is finished.",
      "alts": ["People say the new road is finished.", "They say the new road is complete."]
    },
    "s37-olukiiko": { "text": "The meeting is on Saturday." },
    "s37-ssentebe": {
      "text": "The chairperson speaks at the meeting.",
      "alts": ["The chairman is speaking at the meeting.", "The chairperson is speaking in the meeting."]
    },
    "s37-ndowooza-nti": { "text": "I think that it is good.", "alts": ["I think it is good.", "I think it’s good."] },
    "s37-endowooza-yo": { "text": "What is your opinion?", "alts": ["What do you think?", "What’s your opinion?"] },
    "s37-nzikiriza": { "text": "I agree with you." },
    "s37-sikkiriza": {
      "text": "I don’t agree. I think it isn’t good.",
      "alts": ["I disagree. I think it’s not good.", "I do not agree. I think that it is not good."]
    },
    "s-jamii": { "text": "Our community is big." },
    "s-mkutano": { "text": "There is a meeting tomorrow evening.", "alts": ["There’s a meeting tomorrow evening."] },
    "s-kiongozi": { "text": "Our leader is a capable woman.", "alts": ["Our leader is a skilful woman."] },
    "s-serikali": { "text": "The government will build a new school." },
    "s-uchaguzi": { "text": "The election will be next year." },
    "s-kura": { "text": "I will vote.", "alts": ["I’ll vote."] },
    "s-harambee": { "text": "We are having a harambee for the hospital.", "alts": ["We have a fundraiser for the hospital."] },
    "s-tusaidiane": { "text": "Let’s help each other!", "alts": ["Let us help one another!"] },
    "s-tunapendana": { "text": "In our family we love each other." },
    "s-gazeti": {
      "text": "Dad reads the newspaper every morning.",
      "alts": ["Father reads the newspaper every morning.", "Dad is reading the newspaper every morning."]
    },
    "s-redio": { "text": "I heard the news on the radio." },
    "s-taarifa": { "text": "The news is at eight in the evening.", "alts": ["The news bulletin is at 8 pm.", "The news is at 8 pm."] },
    "s-tukio": { "text": "The event happened in town yesterday.", "alts": ["The incident happened in town yesterday."] },
    "s-tatizo": { "text": "The big problem is water.", "alts": ["The biggest problem is water."] },
    "s-suluhisho": { "text": "We want a solution." },
    "s-maoni": { "text": "What is your opinion?", "alts": ["What’s your opinion?", "What do you think?"] },
    "s-nadhani": { "text": "I think it will rain today.", "alts": ["I think it’ll rain today."] },
    "s-kwa-maoni-yangu": { "text": "In my opinion, school is very important." },
    "s-nakubali": { "text": "I agree, it’s true.", "alts": ["I agree, it is true."] },
    "s-sikubaliani": { "text": "Sorry, I don’t agree with you.", "alts": ["Excuse me, I disagree with you.", "Sorry, I do not agree with you."] }
  },
  "phrases": [
    "Have you heard the news?",
    "He says that rain is coming.",
    "They say that the new road is finished.",
    "I think that it is good.",
    "What is your opinion?",
    "I agree with you."
  ],
  "dialogues": {
    "u37s2l3": [
      {
        "line": "Have you heard the news?",
        "options": ["Yes! They say that the new road is finished.", "I would like tea.", "Once upon a time, one day…"]
      }
    ],
    "u37s3l3": [
      {
        "line": "I think we should plant trees in the village. What is your opinion?",
        "options": ["I agree with you!", "Have you heard it on the radio?", "I am full."]
      }
    ]
  },
  "stories": {
    "sw-harambee": {
      "title": "The harambee",
      "summary": "Amani and Neema go to a harambee for a neighbour’s school fees.",
      "lines": [
        "Amani, why are there so many people here?",
        "It’s a harambee. The neighbour’s child has got a place at university.",
        "Great! I’ll give two thousand shillings.",
        "Thank you. One finger can’t crush a louse.",
        "True. Let’s help each other!"
      ],
      "questions": [
        { "question": "What is the harambee for?", "options": ["A neighbour’s child’s university place", "A wedding", "A new road"] },
        { "question": "What does Amani’s proverb mean?", "options": ["We need each other", "Fingers are small", "Wash your hands"] },
        {
          "question": "How does Neema say “let’s help each other”?",
          "options": ["Let’s help each other", "We love each other", "Let’s go"]
        }
      ]
    },
    "sw-morning-paper": {
      "title": "The morning paper",
      "summary": "Baraka and Juma read the paper over chai and don’t quite agree.",
      "lines": [
        "Juma, have you read today’s paper?",
        "Not yet. What news is there?",
        "The government will build a new road in our village.",
        "In my opinion, water is more important than a road.",
        "Sorry, I don’t agree. A road will bring business.",
        "Then let’s write our opinions to the paper!"
      ],
      "questions": [
        { "question": "What will the government build?", "options": ["A new road", "A new school", "A hospital"] },
        { "question": "What does Juma think is more important?", "options": ["Water", "The road", "Business"] },
        { "question": "How does Baraka say “I don’t agree”?", "options": ["I don’t agree", "I agree", "I think"] }
      ]
    }
  }
}
